{
  "disclaimer": "ATLAS FORGE RWA PUBLIC TESTNET ENGINEERING REHEARSAL. This deployment does not represent a live security, investment product, USD-backed asset, audited protocol, KYC platform, or production issuance.",
  "status": "NOT_EXECUTED",
  "chainId": 11155111,
  "commitSha": "NOT EXECUTED — no public-chain broadcast in this PR",
  "rpc": "",
  "tokenName": "Atlas Forge Permissioned Test Token",
  "tokenSymbol": "AFPT",
  "ackRoleOverlap": false,
  "results": [
    { "testName": "DEPLOY_REGISTRY", "status": "NOT EXECUTED — no public-chain broadcast in this PR", "txHash": "", "notes": "" },
    { "testName": "DEPLOY_COMPLIANCE", "status": "NOT EXECUTED — no public-chain broadcast in this PR", "txHash": "", "notes": "" },
    { "testName": "DEPLOY_TOKEN", "status": "NOT EXECUTED — no public-chain broadcast in this PR", "txHash": "", "notes": "" },
    { "testName": "DEPLOY_ROLE_GRANTS", "status": "NOT EXECUTED — no public-chain broadcast in this PR", "txHash": "", "notes": "" },
    { "testName": "ROLE_ADMIN", "status": "NOT EXECUTED — no public-chain broadcast in this PR", "txHash": "", "notes": "" },
    { "testName": "ROLE_ISSUER", "status": "NOT EXECUTED — no public-chain broadcast in this PR", "txHash": "", "notes": "" },
    { "testName": "ROLE_FREEZER", "status": "NOT EXECUTED — no public-chain broadcast in this PR", "txHash": "", "notes": "" },
    { "testName": "ROLE_RECOVERY", "status": "NOT EXECUTED — no public-chain broadcast in this PR", "txHash": "", "notes": "" },
    { "testName": "UNAUTHORIZED_MINT_REVERT", "status": "NOT EXECUTED — no public-chain broadcast in this PR", "txHash": "", "notes": "Revert is PASS when executed." },
    { "testName": "UNAUTHORIZED_FREEZE_REVERT", "status": "NOT EXECUTED — no public-chain broadcast in this PR", "txHash": "", "notes": "Revert is PASS when executed." },
    { "testName": "UNAUTHORIZED_UNFREEZE_REVERT", "status": "NOT EXECUTED — no public-chain broadcast in this PR", "txHash": "", "notes": "Revert is PASS when executed." },
    { "testName": "UNAUTHORIZED_SET_VERIFIED_REVERT", "status": "NOT EXECUTED — no public-chain broadcast in this PR", "txHash": "", "notes": "Revert is PASS when executed." },
    { "testName": "UNAUTHORIZED_FORCE_TRANSFER_REVERT", "status": "NOT EXECUTED — no public-chain broadcast in this PR", "txHash": "", "notes": "Revert is PASS when executed." },
    { "testName": "UNAUTHORIZED_BURN_REVERT", "status": "NOT EXECUTED — no public-chain broadcast in this PR", "txHash": "", "notes": "Revert is PASS when executed." },
    { "testName": "IDENTITY_ALICE_UNVERIFIED", "status": "NOT EXECUTED — no public-chain broadcast in this PR", "txHash": "", "notes": "Non-PII hash keccak256(ATLAS_TEST_ATTESTATION_ALICE_V1) only." },
    { "testName": "IDENTITY_BOB_UNVERIFIED", "status": "NOT EXECUTED — no public-chain broadcast in this PR", "txHash": "", "notes": "Non-PII hash keccak256(ATLAS_TEST_ATTESTATION_BOB_V1) only." },
    { "testName": "IDENTITY_SET_VERIFIED_ALICE", "status": "NOT EXECUTED — no public-chain broadcast in this PR", "txHash": "", "notes": "" },
    { "testName": "IDENTITY_SET_VERIFIED_BOB", "status": "NOT EXECUTED — no public-chain broadcast in this PR", "txHash": "", "notes": "" },
    { "testName": "MINT_ALICE_1000", "status": "NOT EXECUTED — no public-chain broadcast in this PR", "txHash": "", "notes": "1000e18" },
    { "testName": "MINT_SUPPLY_DELTA", "status": "NOT EXECUTED — no public-chain broadcast in this PR", "txHash": "", "notes": "" },
    { "testName": "TRANSFER_VERIFIED_ALICE_BOB_100", "status": "NOT EXECUTED — no public-chain broadcast in this PR", "txHash": "", "notes": "100e18" },
    { "testName": "TRANSFER_SUPPLY_CONSTANT", "status": "NOT EXECUTED — no public-chain broadcast in this PR", "txHash": "", "notes": "" },
    { "testName": "TRANSFER_UNVERIFIED_ALICE_CHARLIE_REVERT", "status": "NOT EXECUTED — no public-chain broadcast in this PR", "txHash": "", "notes": "NotVerified(CHARLIE) is PASS." },
    { "testName": "TRANSFER_UNVERIFIED_CHARLIE_ALICE_REVERT", "status": "NOT EXECUTED — no public-chain broadcast in this PR", "txHash": "", "notes": "NotVerified(CHARLIE) is PASS." },
    { "testName": "FREEZE_ALICE", "status": "NOT EXECUTED — no public-chain broadcast in this PR", "txHash": "", "notes": "Supply unchanged." },
    { "testName": "FROZEN_ALICE_TO_BOB_REVERT", "status": "NOT EXECUTED — no public-chain broadcast in this PR", "txHash": "", "notes": "AccountFrozen is PASS." },
    { "testName": "FROZEN_BOB_TO_ALICE_REVERT", "status": "NOT EXECUTED — no public-chain broadcast in this PR", "txHash": "", "notes": "AccountFrozen is PASS." },
    { "testName": "UNFREEZE_ALICE", "status": "NOT EXECUTED — no public-chain broadcast in this PR", "txHash": "", "notes": "" },
    { "testName": "TRANSFER_AFTER_UNFREEZE", "status": "NOT EXECUTED — no public-chain broadcast in this PR", "txHash": "", "notes": "" },
    { "testName": "FORCE_TRANSFER_FROZEN_ALICE_TO_REPLACEMENT", "status": "NOT EXECUTED — no public-chain broadcast in this PR", "txHash": "", "notes": "Admin recovery bypass (AFR-06). Replacement may be unverified." },
    { "testName": "FORCE_TRANSFER_SUPPLY_CONSTANT", "status": "NOT EXECUTED — no public-chain broadcast in this PR", "txHash": "", "notes": "" },
    { "testName": "COMPLIANCE_MAX_BALANCE_BELOW_CAP", "status": "NOT EXECUTED — no public-chain broadcast in this PR", "txHash": "", "notes": "" },
    { "testName": "COMPLIANCE_MAX_BALANCE_OVER_CAP_REVERT", "status": "NOT EXECUTED — no public-chain broadcast in this PR", "txHash": "", "notes": "MaxBalanceExceeded is PASS." },
    { "testName": "TAG_ALLOWLIST_TEST_POLICY", "status": "NOT EXECUTED — no public-chain broadcast in this PR", "txHash": "", "notes": "ATLAS_TEST_POLICY_TAG_* codes only." },
    { "testName": "ISSUER_BURN", "status": "NOT EXECUTED — no public-chain broadcast in this PR", "txHash": "", "notes": "" },
    { "testName": "SUPPLY_LEDGER_MATCH", "status": "NOT EXECUTED — no public-chain broadcast in this PR", "txHash": "", "notes": "" }
  ]
}
